Symbol,Name,Last Sale,Net Change,% Change,Market Cap,Country,IPO Year,Volume,Sector,Industry
JPM^L,J P Morgan Chase & Co Depositary Shares each representing a 1/400th interest in a share of 4.625% Non-Cumulative Preferred Stock Series LL,$19.73 ,-0.1,-0.50%,,United States,,163289,,
JPM^M,J P Morgan Chase & Co Depositary Shares each representing a 1/400th interest in a share of 4.20% Non-Cumulative Preferred Stock Series MM,$18.10 ,-0.09,-0.50%,,United States,,354055,,
JQC,Nuveen Credit Strategies Income Fund Shares of Beneficial Interest,$5.04 ,-0.01,-0.20%,0,United States,2003,706398,Finance,Finance Companies
JRI,Nuveen Real Asset Income and Growth Fund Common Shares of Beneficial Interest,$13.70 ,-0.02,-0.15%,0,United States,2012,111474,Finance,Finance Companies
JRS,Nuveen Real Estate Income Fund Common Shares of Beneficial Interest,$7.77 ,0.02,0.26%,0,United States,2001,43182,Finance,Finance/Investors Services
JRSH,Jerash Holdings (US) Inc. Common Stock,$3.04 ,-0.05,-1.62%,38607818,United States,2018,58646,Consumer Discretionary,Apparel
JSM,Navient Corporation 6% Senior Notes due December 15 2043,$19.35 ,-0.055,-0.28%,1923990585,United States,,18916,Finance,Investment Bankers/Brokers/Service
JSPR,Jasper Therapeutics Inc. Common Stock,$1.77 ,-0.07,-3.80%,49531749,United States,2020,574245,Health Care,Biotechnology: Biological Products (No Diagnostic Substances)
JSPRW,Japer Therapeutics Inc. Warrants,$0.13 ,0,0.00%,3498005,United States,2020,3269,Health Care,Biotechnology: Biological Products (No Diagnostic Substances)
JTAI,Jet.AI Inc. Common Stock,$1.44 ,-0.1183,-7.58%,8992252,United States,2021,113292,Consumer Discretionary,Transportation Services
JUNS,Jupiter Neurosciences Inc. Common Stock,$1.12 ,-0.06,-5.09%,38557518,United States,2024,41514,Health Care,Biotechnology: Pharmaceutical Preparations
JVA,Coffee Holding Co. Inc. Common Stock,$3.53 ,0.04,1.15%,20151354,United States,2005,14597,Consumer Staples,Packaged Foods
JXN,Jackson Financial Inc. Class A Common Stock ,$105.82 ,-0.08,-0.08%,7192570797,United States,2021,447361,Finance,Life Insurance
JXN^A,Jackson Financial Inc. Depositary Shares each representing a 1/1000th interest in a share of Fixed-Rate Reset Noncumulative Perpetual Preferred Stock Series A,$25.92 ,-0.11,-0.42%,,United States,,12784,,
JYNT,The Joint Corp. Common Stock,$8.71 ,-0.27,-3.01%,129484532,United States,2014,163624,Miscellaneous,Multi-Sector Companies
KAI,Kadant Inc Common Stock,$292.22 ,-2.36,-0.80%,3441806610,United States,1992,200162,Industrials,Industrial Machinery/Components
KALA,KALA BIO Inc. Common Stock,$0.68 ,-0.0196,-2.82%,13389030,United States,2017,1354260,Health Care,Biotechnology: Pharmaceutical Preparations
KALU,Kaiser Aluminum Corporation Common Stock,$108.79 ,-0.74,-0.68%,1763078481,United States,,175752,Industrials,Metal Fabrications
KALV,KalVista Pharmaceuticals Inc. Common Stock,$16.91 ,0.01,0.06%,854737815,United Kingdom,2015,597063,Health Care,Biotechnology: Pharmaceutical Preparations
KAR,OPENLANE Inc. Common Stock,$28.65 ,-0.01,-0.04%,3044440308,United States,2009,1176165,Consumer Discretionary,Retail-Auto Dealers and Gas Stations
KAVL,Kaival Brands Innovations Group Inc. Common Stock,$0.14 ,-0.0599,-29.95%,1617077,United States,,58421954,Consumer Discretionary,Other Consumer Services
KBH,KB Home Common Stock,$65.55 ,0.48,0.74%,4245325102,United States,1986,1511517,Consumer Discretionary,Homebuilding
KBONU,Karbon Capital Partners Corp. Units,$10.07 ,0.02,0.20%,0,United States,2025,539894,Finance,Blank Checks
KBR,KBR Inc. Common Stock,$43.48 ,-0.54,-1.23%,5521509025,United States,2006,850598,Industrials,Military/Government/Technical
KCHV,Kochav Defense Acquisition Corp. Class A Ordinary Shares,$10.13 ,-0.005,-0.05%,0,United States,2025,1386,,
KCHVR,Kochav Defense Acquisition Corp. Right,$0.23 ,-0.0097,-4.06%,0,United States,2025,124657,Finance,Blank Checks
KCHVU,Kochav Defense Acquisition Corp. Units,$10.35 ,0,0.00%,0,United States,2025,77,,
KD,Kyndryl Holdings Inc. Common Stock,$26.92 ,-0.25,-0.92%,6152952221,United States,2021,1257121,Technology,EDP Services
KDK,Kodiak AI Inc. Common Stock ,$8.28 ,0.01,0.12%,1500397206,United States,,860121,Technology,EDP Services
KDKRW,Kodiak AI Inc. Warrants,$1.44 ,0,0.00%,260938644,United States,,1486,Technology,EDP Services
KDP,Keurig Dr Pepper Inc. Common Stock,$29.51 ,0.04,0.14%,40091788019,United States,,16504914,Consumer Staples,Beverages (Production/Distribution)
KE,Kimball Electronics Inc. Common Stock,$30.34 ,-0.99,-3.16%,738425933,United States,,180129,Technology,Electrical Products
KELYA,Kelly Services Inc. Class A Common Stock,$9.08 ,0.17,1.91%,320878174,United States,,454750,Consumer Discretionary,Professional Services
KELYB,Kelly Services Inc. Class B Common Stock,$9.14 ,0,0.00%,322998515,United States,,16,Consumer Discretionary,Professional Services
KEQU,Kewaunee Scientific Corporation Common Stock,$37.78 ,-0.48,-1.26%,108265919,United States,,14023,Industrials,Medical Specialities
KEX,Kirby Corporation Common Stock,$111.01 ,-1.08,-0.96%,6016742000,United States,,676842,Consumer Discretionary,Marine Transportation
KEY,KeyCorp Common Stock,$20.66 ,-0.03,-0.15%,22579718709,United States,,17219399,Finance,Major Banks
KEY^I,KeyCorp Depositary Shares Each Representing a 1/40th Ownership Interest in a Share of Fixed-to-Floating Rate Perpetual Non-Cumulative Preferred Stock Series E,$24.85 ,-0.05,-0.20%,,United States,,64252,,
KEY^J,KeyCorp Depositary Shares each representing a 1/40th ownership interest in a share of Fixed Rate Perpetual Non-Cumulative Preferred Stock Series F,$21.15 ,-0.02,-0.09%,,United States,,34096,,
KEY^K,KeyCorp Depositary Shares each representing a 1/40th ownership interest in a share of Fixed Rate Perpetual Non-Cumulative Preferred Stock Series G,$21.04 ,-0.01,-0.05%,,United States,,390838,,
KEY^L,KeyCorp Depositary Shares each representing a 1/40th ownership interest in a share of Fixed Rate Perpetual Non-Cumulative Preferred Stock Series H,$24.85 ,-0.07,-0.28%,,United States,,19568,,
KEYS,Keysight Technologies Inc. Common Stock,$208.81 ,-5.33,-2.49%,35885303354,United States,2014,1151445,Industrials,Industrial Machinery/Components
KF,Korea Fund Inc. (The) New Common Stock,$35.10 ,-0.83,-2.31%,0,United States,,8205,Finance,Investment Managers
KFFB,Kentucky First Federal Bancorp Common Stock,$4.72 ,0.4775,11.26%,38149078,United States,2005,6366,Finance,Savings Institutions
KFII,K&F Growth Acquisition Corp. II Class A Ordinary shares,$10.31 ,0,0.00%,0,United States,2025,300,,
KFIIR,K&F Growth Acquisition Corp. II Rights,$0.20 ,0,0.00%,0,United States,2025,1122,,
KFIIU,K&F Growth Acquisition Corp. II Unit,$11.80 ,0.2,1.72%,0,United States,2025,1000,Finance,Blank Checks
KFRC,Kforce Inc. Common Stock,$30.89 ,-0.03,-0.10%,560375490,United States,1995,376068,Consumer Discretionary,Professional Services
KFS,Kingsway Financial Services Inc. Common Stock (DE),$12.73 ,0.01,0.08%,368611815,Canada,,61553,Finance,Property-Casualty Insurers
KFY,Korn Ferry Common Stock,$69.88 ,1.18,1.72%,3647382687,United States,1999,750260,Consumer Discretionary,Diversified Commercial Services
KGC,Kinross Gold Corporation Common Stock,$27.92 ,-0.63,-2.21%,33702232000,Canada,2001,11150804,Basic Materials,Precious Metals
KGEI,Kolibri Global Energy Inc. Common stock,$4.07 ,0.02,0.49%,143983710,United States,,144887,Energy,Oil & Gas Production
KGS,Kodiak Gas Services Inc. Common Stock,$37.27 ,-0.66,-1.74%,3230707462,United States,2023,1168868,Utilities,Natural Gas Distribution
KHC,The Kraft Heinz Company Common Stock,$24.45 ,0.06,0.25%,28940378907,United States,,11338593,Consumer Staples,Packaged Foods
KIDS,OrthoPediatrics Corp. Common Stock,$17.60 ,-0.73,-3.98%,441361008,United States,2017,181241,Health Care,Medical/Dental Instruments
KIDZ,Classover Holdings Inc. Class B Common Stock,$0.30 ,-0.0333,-9.97%,8428180,United States,,698241,Real Estate,Other Consumer Services
KIDZW,Classover Holdings Inc. Warrants,$0.02 ,-0.0001,-0.43%,644656,United States,,36878,Real Estate,Other Consumer Services
KIM,Kimco Realty Corporation (HC) Common Stock,$20.16 ,0.03,0.15%,13652253660,United States,,2801901,Real Estate,Real Estate Investment Trusts
KIM^L,Kimco Realty Corporation Class L Depositary Shares each of which represents a one-one thousandth fractional interest in a share of 5.125% Class L Cumulative Redeemable Preferred Stock liquidation preference $25000.00 per share,$20.28 ,-0.08,-0.39%,,United States,,14498,,
KIM^M,Kimco Realty Corporation Class M Depositary Shares each of which represents a one-one thousandth fractional interest in a share of 5.25% Class M Cumulative Redeemable Preferred Stock liquidation preference $25000.00 per share,$20.42 ,-0.23,-1.11%,,United States,,17592,,
KIM^N,Kimco Realty Corporation Depositary Shares each representing 1/1000th interest in a share of 7.25% Class N Cumulative Convertible Perpetual Preferred Stock,$58.30 ,-0.1,-0.17%,,United States,,586,,
KINS,Kingstone Companies Inc. Common Stock,$15.97 ,0.28,1.79%,225934425,United States,,169706,Finance,Property-Casualty Insurers
KIO,KKR Income Opportunities Fund Common Shares,$11.59 ,-0.13,-1.11%,0,United States,2013,416014,Finance,Investment Managers
KITT,Nauticus Robotics Inc. Common stock,$0.91 ,-0.1612,-15.07%,12460207,United States,2021,6283491,Industrials,Industrial Machinery/Components
KITTW,Nauticus Robotics Inc. Warrant,$0.10 ,0.0112,12.83%,1350496,United States,2021,214712,Industrials,Industrial Machinery/Components
KKR,KKR & Co. Inc. Common Stock,$136.60 ,-6.17,-4.32%,1.21759E+11,United States,,5443403,Finance,Investment Managers
KKR^D,KKR & Co. Inc. 6.25% Series D Mandatory Convertible Preferred Stock,$54.40 ,-2.21,-3.90%,,United States,,820616,,
KKRS,KKR Group Finance Co. IX LLC 4.625% Subordinated Notes due 2061,$17.68 ,-0.08,-0.45%,15759128289,United States,2021,30715,Finance,Investment Managers
KKRT,KKR & Co. Inc. 6.875% Subordinated Notes due 2065,$25.58 ,0.03,0.12%,0,United States,2025,46170,Finance,Investment Managers
KLAC,KLA Corporation Common Stock,"$1,193.92 ",-52.26,-4.19%,1.56872E+11,United States,1980,1143871,Technology,Electronic Components
KLC,KinderCare Learning Companies Inc. Common Stock,$4.60 ,-0.02,-0.43%,544265348,United States,2024,589360,Consumer Discretionary,Other Consumer Services
KLRS,Kalaris Therapeutics Inc. Common Stock,$8.87 ,0.54,6.48%,165890448,United States,2020,186876,Health Care,Biotechnology: Biological Products (No Diagnostic Substances)
KLTO,Klotho Neurosciences Inc. Common Stock,$0.40 ,-0.0238,-5.61%,29043703,United States,2022,948907,Health Care,Biotechnology: Biological Products (No Diagnostic Substances)
KLTOW,Klotho Neurosciences Inc. Warrant,$0.13 ,0,0.00%,9248432,United States,2022,214,Health Care,Biotechnology: Biological Products (No Diagnostic Substances)
KLTR,Kaltura Inc. Common Stock,$1.61 ,-0.07,-4.17%,251697993,United States,2021,311467,Technology,Computer Software: Prepackaged Software
KLXE,KLX Energy Services Holdings Inc. Common Stock,$1.94 ,0,0.00%,34605963,United States,,134036,Energy,Oilfield Services/Equipment
KMB,Kimberly-Clark Corporation Common Stock,$103.15 ,-0.3,-0.29%,34231196126,United States,,4961633,Consumer Discretionary,Containers/Packaging
KMI,Kinder Morgan Inc. Common Stock,$26.73 ,-0.09,-0.34%,59467845225,United States,2011,10578616,Utilities,Natural Gas Distribution
KMPB,Kemper Corporation 5.875% Fixed-Rate Reset Junior Subordinated Debentures due 2062,$23.40 ,-0.0869,-0.37%,1369996524,United States,2022,7093,Finance,Property-Casualty Insurers
KMPR,Kemper Corporation,$41.26 ,0.41,1.00%,2415643444,United States,,752262,Finance,Property-Casualty Insurers
KMT,Kennametal Inc. Common Stock,$29.33 ,-0.46,-1.54%,2231811679,United States,,1535660,Industrials,Industrial Machinery/Components
KMTS,Kestra Medical Technologies Ltd. Common Stock,$26.17 ,1.26,5.06%,1500814328,United States,2025,414615,Health Care,Medical/Dental Instruments
KMX,CarMax Inc,$41.01 ,-0.64,-1.54%,6022115213,United States,,3375529,Consumer Discretionary,Retail-Auto Dealers and Gas Stations
KN,Knowles Corporation Common Stock,$22.88 ,-1.16,-4.83%,1948275106,United States,2014,540233,Consumer Staples,Consumer Electronics/Appliances
KNF,Knife Riv Holding Co. Common Stock,$77.29 ,-1.21,-1.54%,4379573313,United States,2023,450868,Industrials,Mining & Quarrying of Nonmetallic Minerals (No Fuels)
KNOP,KNOT Offshore Partners LP Common Units representing Limited Partner Interests,$10.74 ,0.11,1.04%,365644170,United Kingdom,2013,182025,Consumer Discretionary,Marine Transportation
KNSA,Kiniksa Pharmaceuticals International plc Class A Ordinary Shares,$41.59 ,0.58,1.41%,3152345617,United States,2018,489807,Health Care,Biotechnology: Pharmaceutical Preparations
KNSL,Kinsale Capital Group Inc. Common Stock,$391.76 ,3.62,0.93%,9113679770,United States,,280539,Finance,Property-Casualty Insurers
KNTK,Kinetik Holdings Inc. Class A Common Stock,$36.45 ,-1.21,-3.21%,5889774927,United States,2022,1118514,Utilities,Natural Gas Distribution
KNX,Knight-Swift Transportation Holdings Inc.,$53.22 ,0.73,1.39%,8639681580,United States,2017,4726392,Industrials,Trucking Freight/Courier Services
KO,Coca-Cola Company (The) Common Stock,$70.52 ,1.41,2.04%,3.03349E+11,United States,,18435962,Consumer Staples,Beverages (Production/Distribution)
KOD,Kodiak Sciences Inc Common Stock,$23.81 ,-0.32,-1.33%,1263083071,United States,2018,423341,Health Care,Biotechnology: Biological Products (No Diagnostic Substances)
KODK,Eastman Kodak Company Common New,$8.66 ,-0.35,-3.89%,834824000,United States,,1321453,Consumer Discretionary,Industrial Machinery/Components
KOP,Koppers Holdings Inc. Common Stock,$29.01 ,-0.25,-0.85%,568999993,United States,2006,151539,Basic Materials,Forest Products
KOPN,Kopin Corporation Common Stock,$2.54 ,-0.28,-9.93%,469279298,United States,1992,3068453,Technology,Semiconductors
KORE,KORE Group Holdings Inc. Common Stock,$4.50 ,-0.01,-0.22%,78929717,United States,,40900,Telecommunications,Telecommunications Equipment
KOSS,Koss Corporation Common Stock,$4.58 ,-0.14,-2.97%,43310486,United States,,16033,Consumer Staples,Consumer Electronics/Appliances
KOYN,CSLM Digital Asset Acquisition Corp III Class A Ordinary Shares,$9.93 ,0,0.00%,0,United States,2025,25141,,
KOYNU,CSLM Digital Asset Acquisition Corp III Units,$10.14 ,-0.01,-0.10%,0,United States,2025,2870,,
KOYNW,CSLM Digital Asset Acquisition Corp III Warrants,$0.44 ,-0.0105,-2.33%,0,United States,2025,12178,,
KPLT,Katapult Holdings Inc. Common Stock,$7.13 ,0.925,14.91%,33106971,United States,2019,20750896,Consumer Discretionary,Diversified Commercial Services
KPLTW,Katapult Holdings Inc. Warrant,$0.01 ,-0.0008,-13.56%,23681,United States,2019,1578521,Consumer Discretionary,Diversified Commercial Services
KPRX,Kiora Pharmaceuticals Inc.  Common Stock,$2.14 ,-0.005,-0.23%,7852391,United States,,13051,Health Care,Biotechnology: Pharmaceutical Preparations
KPTI,Karyopharm Therapeutics Inc. Common Stock,$6.95 ,-0.05,-0.71%,118503588,United States,2013,222149,Health Care,Biotechnology: Pharmaceutical Preparations
KR,Kroger Company (The) Common Stock,$63.19 ,0.98,1.58%,41874636216,United States,,5386346,Consumer Staples,Food Chains
KRC,Kilroy Realty Corporation Common Stock,$40.46 ,-0.11,-0.27%,4786648703,United States,1997,1756387,Real Estate,Real Estate Investment Trusts
KREF,KKR Real Estate Finance Trust Inc. Common Stock,$8.91 ,-0.03,-0.34%,583504139,United States,2017,1182805,Real Estate,Real Estate Investment Trusts
KREF^A,KKR Real Estate Finance Trust Inc. 6.50% Series A Cumulative Redeemable Preferred Stock,$18.45 ,-0.1,-0.54%,,United States,,41898,,
KRG,Kite Realty Group Trust Common Stock,$23.34 ,0.25,1.08%,5053249410,United States,2004,1614675,Real Estate,Real Estate Investment Trusts
KRMD,KORU Medical Systems Inc. Common Stock (DE),$5.78 ,-0.08,-1.37%,267744946,United States,,124709,Health Care,Medical/Dental Instruments
KRMN,Karman Holdings Inc. Common Stock,$68.44 ,-0.93,-1.34%,9056147451,United States,2025,1747169,Industrials,Military/Government/Technical
KRNY,Kearny Financial Corp Common Stock,$7.77 ,-0.03,-0.39%,503023203,United States,2005,366871,Finance,Savings Institutions
KRO,Kronos Worldwide Inc Common Stock,$5.11 ,0.2,4.07%,587921423,United States,,572544,Basic Materials,Major Chemicals
KROS,Keros Therapeutics Inc. Common Stock,$21.51 ,-0.18,-0.83%,655325144,United States,2020,411421,Health Care,Biotechnology: Pharmaceutical Preparations
KRP,Kimbell Royalty Partners Common Units Representing Limited Partner Interests,$12.28 ,-0.03,-0.24%,1324864984,United States,2017,495798,Energy,Oil & Gas Production
KRRO,Korro Bio Inc. Common Stock,$8.23 ,0.33,4.18%,77504338,United States,2019,383799,Health Care,Biotechnology: Pharmaceutical Preparations
KRT,Karat Packaging Inc. Common Stock,$23.03 ,0.08,0.35%,462891600,United States,2021,134584,Industrials,Plastic Products
KRUS,Kura Sushi USA Inc. Class A Common Stock,$51.63 ,-1.19,-2.25%,625315558,United States,2019,265065,Consumer Discretionary,Restaurants
KRYS,Krystal Biotech Inc. Common Stock,$244.65 ,-2.125,-0.86%,7094243023,United States,2017,334039,Health Care,Biotechnology: Biological Products (No Diagnostic Substances)
KSCP,Knightscope Inc. Class A Common Stock,$4.76 ,-0.24,-4.80%,54782183,United States,2022,601419,Telecommunications,Telecommunications Equipment
KSS,Kohl's Corporation Common Stock,$23.27 ,-0.63,-2.64%,2610642475,United States,1992,2675534,Consumer Discretionary,Department/Specialty Retail Stores
KTB,Kontoor Brands Inc. Common Stock ,$66.54 ,-1.64,-2.41%,3699198942,United States,2019,717299,Industrials,Garments and Clothing
KTCC,Key Tronic Corporation Common Stock,$2.54 ,-0.03,-1.17%,27582543,United States,1983,15560,Technology,Electrical Products
KTF,DWS Municipal Income Trust,$9.15 ,-0.04,-0.44%,361433583,United States,1988,110755,Finance,Finance Companies
KTH,Structures Products Cp 8% CorTS Issued by Peco Energy Cap Tr II Preferred Stock,$28.71 ,0.105,0.37%,0,United States,,2539,Finance,Finance: Consumer Services
KTN,Structured Products Corp 8.205% CorTS 8.205% Corporate Backed Trust Securities (CorTS),$26.72 ,0.054,0.20%,0,United States,,110,Finance,Finance: Consumer Services
KTOS,Kratos Defense & Security Solutions Inc. Common Stock,$75.96 ,-2.82,-3.58%,12825140180,United States,,1916054,Industrials,Military/Government/Technical
KTTA,Pasithea Therapeutics Corp. Common Stock,$1.13 ,0.01,0.89%,25310780,United States,2021,366416,Health Care,Biotechnology: Pharmaceutical Preparations
KTTAW,Pasithea Therapeutics Corp. Warrant,$0.03 ,-0.007,-18.92%,671968,United States,2021,28933,Health Care,Biotechnology: Pharmaceutical Preparations
KULR,KULR Technology Group Inc. Common Stock,$3.80 ,-0.09,-2.31%,173591703,United States,,2710795,Technology,Electrical Products
KURA,Kura Oncology Inc. Common Stock,$10.22 ,-0.24,-2.29%,889319034,United States,,1478401,Health Care,Biotechnology: Pharmaceutical Preparations
KVAC,Keen Vision Acquisition Corporation Ordinary Shares,$11.68 ,-0.01,-0.09%,0,United States,2023,452,,
KVACW,Keen Vision Acquisition Corporation Warrant,$0.06 ,-0.0057,-8.69%,0,United States,2023,68863,,
KVHI,KVH Industries Inc. Common Stock,$6.91 ,0.16,2.37%,135251164,United States,1996,113852,Technology,Radio And Television Broadcasting And Communications Equipment
KVUE,Kenvue Inc. Common Stock,$17.33 ,0.01,0.06%,33200851606,United States,2023,46962009,Consumer Discretionary,Specialty Chemicals
KVYO,Klaviyo Inc. Series A Common Stock,$29.84 ,-0.31,-1.03%,9010047155,United States,2023,2280307,Technology,Computer Software: Prepackaged Software
KW,Kennedy-Wilson Holdings Inc. Common Stock,$9.85 ,-0.09,-0.91%,1358358281,United States,,920566,Finance,Real Estate
KWR,Quaker Houghton Common Stock,$138.99 ,-3.25,-2.29%,2410091465,United States,,138087,Industrials,Major Chemicals
KYMR,Kymera Therapeutics Inc. Common Stock,$89.68 ,1.87,2.13%,7061508484,United States,2020,1863753,Health Care,Biotechnology: Biological Products (No Diagnostic Substances)
KYN,Kayne Anderson Energy Infrastructure Fund Inc.,$12.12 ,0.05,0.41%,1649914144,United States,2004,258709,Finance,Finance/Investors Services
KYTX,Kyverna Therapeutics Inc. Common Stock,$8.78 ,0.42,5.02%,384530373,United States,2024,1105788,Health Care,Biotechnology: Biological Products (No Diagnostic Substances)
KZR,Kezar Life Sciences Inc. Common Stock,$6.24 ,-0.06,-0.95%,45696493,United States,2018,41519,Health Care,Biotechnology: Pharmaceutical Preparations
L,Loews Corporation Common Stock,$104.31 ,-0.34,-0.33%,21556659434,United States,,634500,Finance,Property-Casualty Insurers
LAB,Standard BioTools Inc. Common Stock,$1.45 ,-0.03,-2.03%,557619850,United States,2011,958392,Industrials,Biotechnology: Laboratory Analytical Instruments
LAC,Lithium Americas Corp. Common Shares,$5.12 ,-0.21,-3.94%,1553860035,Canada,2023,11054745,Basic Materials,Metal Mining
LAD,Lithia Motors Inc. Common Stock,$344.38 ,-12.28,-3.44%,8351225331,United States,,255507,Consumer Discretionary,Retail-Auto Dealers and Gas Stations
LADR,Ladder Capital Corp Class A Common Stock,$11.37 ,0.02,0.18%,1447644204,United States,2014,707184,Real Estate,Real Estate Investment Trusts
LAKE,Lakeland Industries Inc. Common Stock,$8.99 ,-0.15,-1.64%,88157091,United States,1986,642676,Health Care,Industrial Specialties
LAMR,Lamar Advertising Company Class A Common Stock,$128.00 ,-1.22,-0.94%,12964311296,United States,1996,590452,Real Estate,Real Estate Investment Trusts
LAND,Gladstone Land Corporation Common Stock,$8.97 ,-0.04,-0.44%,334283492,United States,1993,542330,Real Estate,Real Estate Investment Trusts
LANDM,Gladstone Land Corporation 5.00% Series D Cumulative Term Preferred Stock,$24.91 ,-0.0199,-0.08%,928320537,United States,,10877,Real Estate,Real Estate Investment Trusts
LANDO,Gladstone Land Corporation 6.00% Series B Cumulative Redeemable Preferred Stock,$18.73 ,-0.1,-0.53%,698007782,United States,,18289,Real Estate,Real Estate Investment Trusts
LANDP,Gladstone Land Corporation 6.00% Series C Cumulative Redeemable Preferred Stock,$18.66 ,-0.14,-0.75%,695399104,United States,,61281,Real Estate,Real Estate Investment Trusts
LAR,Lithium Argentina AG Common Shares,$5.30 ,-0.15,-2.75%,860190000,Canada,2023,4139500,Basic Materials,Metal Mining
LARK,Landmark Bancorp Inc. Common Stock,$28.81 ,0.22,0.77%,175167911,United States,,6673,Finance,Major Banks
LASE,Laser Photonics Corporation Common Stock,$2.96 ,-0.02,-0.67%,42257404,United States,2022,125492,Miscellaneous,Industrial Machinery/Components
LASR,nLIGHT Inc. Common Stock,$36.12 ,-2.11,-5.52%,1834390573,United States,2018,531282,Technology,Semiconductors
LATA,Galata Acquisition Corp. II Class A Ordinary Shares,$9.96 ,0,0.00%,0,United States,2025,4601,Finance,Blank Checks
LATAU,Galata Acquisition Corp. II Units,$10.10 ,0,0.00%,0,United States,2025,7,,
LAUR,Laureate Education Inc. Common Stock,$32.14 ,-0.54,-1.65%,4736444867,United States,2017,1468992,Real Estate,Other Consumer Services
LAW,CS Disco Inc. Common Stock,$8.67 ,-0.24,-2.69%,541802120,United States,2021,242034,Technology,Computer Software: Prepackaged Software
LAZR,Luminar Technologies Inc.  Class A Common Stock,$0.90 ,-0.0665,-6.88%,70049809,United States,2019,5261863,Consumer Discretionary,Auto Parts:O.E.M.
LBRDA,Liberty Broadband Corporation Class A Common Stock,$47.88 ,-1.11,-2.27%,6870281234,United States,,200348,Telecommunications,Cable & Other Pay Television Services
LBRDK,Liberty Broadband Corporation Class C Common Stock,$47.98 ,-1.22,-2.48%,6884630192,United States,,645000,Telecommunications,Cable & Other Pay Television Services
LBRDP,Liberty Broadband Corporation Series A Cumulative Redeemable Preferred Stock,$24.40 ,-0.0185,-0.08%,3501145825,United States,,6369,Telecommunications,Cable & Other Pay Television Services
LBRT,Liberty Energy Inc. Class A common stock,$19.26 ,-1.43,-6.91%,3119483496,United States,2018,5301877,Energy,Oilfield Services/Equipment
LBRX,LB Pharmaceuticals Inc Common Stock,$19.13 ,-1.105,-5.46%,483845326,United States,2025,380391,Health Care,Biotechnology: Pharmaceutical Preparations
LBTYA,Liberty Global Ltd. Class A Common Shares,$11.25 ,0.04,0.36%,3788764200,United Kingdom,,3207485,Telecommunications,Cable & Other Pay Television Services
LBTYB,Liberty Global Ltd. Class B Common Shares,$11.28 ,0.32,2.92%,3798867571,United Kingdom,,1699,Telecommunications,Cable & Other Pay Television Services
LBTYK,Liberty Global Ltd. Class C Common Shares,$11.07 ,-0.07,-0.63%,3728143973,United Kingdom,,1050325,Telecommunications,Cable & Other Pay Television Services
LC,LendingClub Corporation Common Stock,$19.90 ,-0.5,-2.45%,2294498656,United States,2014,1714872,Finance,Finance: Consumer Services
LCCC,Lakeshore Acquisition III Corp. Ordinary Shares,$10.19 ,0,0.00%,0,United States,2025,1,Finance,Blank Checks
LCCCR,Lakeshore Acquisition III Corp. Rights,$0.25 ,0,0.00%,0,United States,2025,92,Finance,Blank Checks
LCCCU,Lakeshore Acquisition III Corp. Unit,$10.29 ,-0.03,-0.29%,0,United States,2025,1108,Finance,Blank Checks
LCID,Lucid Group Inc. Common Stock,$12.54 ,-0.29,-2.26%,4065072451,United States,,5412384,Industrials,Auto Manufacturing
LCII,LCI Industries,$121.76 ,-0.35,-0.29%,2946349698,United States,1995,275371,Consumer Discretionary,Auto Parts:O.E.M.
LCNB,LCNB Corporation Common Stock,$17.29 ,-0.05,-0.29%,245287092,United States,,34416,Finance,Major Banks
LCTX,Lineage Cell Therapeutics Inc. Common Stock,$1.66 ,-0.05,-2.92%,382343711,United States,,802800,Health Care,Biotechnology: Biological Products (No Diagnostic Substances)
LCUT,Lifetime Brands Inc. Common Stock,$4.08 ,-0.12,-2.86%,92436439,United States,1991,33729,Consumer Discretionary,Industrial Machinery/Components
LDI,loanDepot Inc. Class A Common Stock,$2.60 ,-0.18,-6.48%,866413402,United States,2021,3754883,Finance,Finance: Consumer Services
