Symbol,Name,Last Sale,Net Change,% Change,Market Cap,Country,IPO Year,Volume,Sector,Industry
DEI,Douglas Emmett Inc. Common Stock,$11.64 ,-0.12,-1.02%,1949258367,United States,2006,2250945,Real Estate,Real Estate Investment Trusts
DELL,Dell Technologies Inc. Class C Common Stock ,$129.98 ,-8.62,-6.22%,86136394858,United States,2018,9285485,Technology,Computer Manufacturing
DENN,Denny's Corporation Common Stock,$6.20 ,0.01,0.16%,319293763,United States,,2235036,Consumer Discretionary,Restaurants
DEO,Diageo plc Common Stock,$89.09 ,1.3,1.48%,49587774188,United Kingdom,,1874053,Consumer Staples,Beverages (Production/Distribution)
DERM,Journey Medical Corporation Common Stock,$7.67 ,-0.11,-1.41%,208132391,United States,2021,83329,Health Care,Biotechnology: Pharmaceutical Preparations
DEVS,DevvStream Corp. Common Stock,$1.68 ,-0.03,-1.75%,8629560,Canada,2024,196789,Finance,Finance/Investors Services
DFDV,DeFi Development Corp. Common Stock,$5.56 ,-0.15,-2.63%,174590739,United States,2023,2364406,Finance,Finance: Consumer Services
DFDVW,DeFi Development Corp. Warrant,$3.26 ,-0.12,-3.55%,102367951,United States,,5692,,
DFH,Dream Finders Homes Inc. Class A Common Stock,$19.90 ,0.27,1.38%,1845818888,United States,2022,411076,Consumer Discretionary,Homebuilding
DFIN,Donnelley Financial Solutions Inc. Common Stock ,$45.86 ,-0.39,-0.84%,1216990626,United States,2016,211354,Consumer Discretionary,Other Consumer Services
DFLI,Dragonfly Energy Holdings Corp. Common Stock (NV),$0.79 ,-0.078,-8.95%,95796211,United States,2021,4924010,Miscellaneous,Industrial Machinery/Components
DFLIW,Dragonfly Energy Holdings Corp. Warrant,$0.13 ,0.0028,2.12%,16270016,United States,2021,30527,Miscellaneous,Industrial Machinery/Components
DFSC,DEFSEC Technologies Inc. Common Stock,$3.29 ,-0.02,-0.60%,4593896,Canada,,16272,Technology,Computer Software: Prepackaged Software
DFSCW,DEFSEC Technologies Inc. Warrant,$0.03 ,0,0.00%,42169,Canada,,1000,Technology,Computer Software: Prepackaged Software
DG,Dollar General Corporation Common Stock,$133.21 ,0.53,0.40%,29322034806,United States,2009,4592749,Consumer Discretionary,Department/Specialty Retail Stores
DGICA,Donegal Group Inc. Class A Common Stock,$20.36 ,0.12,0.59%,746022182,United States,,161299,Finance,Property-Casualty Insurers
DGICB,Donegal Group Inc. Class B Common Stock,$15.71 ,-0.48,-2.97%,575638923,United States,1986,6741,Finance,Property-Casualty Insurers
DGII,Digi International Inc. Common Stock,$45.51 ,-1.7,-3.60%,1694455307,United States,1989,228897,Telecommunications,Computer Communications Equipment
DGLY,Digital Ally Inc. Common Stock,$1.13 ,-0.12,-9.60%,2145233,United States,,109735,Technology,Radio And Television Broadcasting And Communications Equipment
DGX,Quest Diagnostics Incorporated Common Stock,$182.56 ,0.99,0.55%,20308405607,United States,,1138989,Health Care,Medical Specialities
DGXX,Digi Power X Inc. Subordinate Voting Shares,$3.21 ,-0.44,-12.06%,200366829,Canada,,5332508,Finance,Finance: Consumer Services
DH,Definitive Healthcare Corp. Class A Common Stock,$2.31 ,0.01,0.44%,238630824,United States,2021,707983,Technology,Computer Software: Prepackaged Software
DHC,Diversified Healthcare Trust Common Shares of Beneficial Interest,$4.69 ,0.01,0.21%,1135669252,United States,,726503,Real Estate,Real Estate Investment Trusts
DHCNI,Diversified Healthcare Trust 5.625% Senior Notes due 2042,$16.77 ,-0.69,-3.95%,4048518767,United States,,7932,Real Estate,Real Estate Investment Trusts
DHCNL,Diversified Healthcare Trust 6.25% Senior Notes Due 2046,$18.11 ,-0.63,-3.36%,4372014005,United States,,20424,Real Estate,Real Estate Investment Trusts
DHF,BNY Mellon High Yield Strategies Fund Common Stock,$2.51 ,-0.01,-0.40%,0,United States,1998,190316,Finance,Finance Companies
DHI,D.R. Horton Inc. Common Stock,$156.45 ,1.25,0.81%,45692871170,United States,,2477221,Consumer Discretionary,Homebuilding
DHIL,Diamond Hill Investment Group Inc. Class A Common Stock,$169.00 ,-0.74,-0.44%,457195024,United States,,64038,Finance,Investment Managers
DHR,Danaher Corporation Common Stock,$226.33 ,-6.04,-2.60%,1.59868E+11,United States,,4857445,Industrials,Industrial Machinery/Components
DHX,DHI Group Inc. Common Stock,$1.59 ,0.01,0.63%,74979673,United States,2007,244333,Real Estate,Real Estate
DHY,Credit Suisse High Yield Credit Fund Common Stock,$2.04 ,0.01,0.49%,0,United States,1998,370338,Finance,Finance/Investors Services
DIBS,1stdibs.com Inc. Common Stock,$5.99 ,0.08,1.35%,219319945,United States,2021,230031,Consumer Discretionary,Catalog/Specialty Distribution
DIN,Dine Brands Global Inc. Common Stock,$34.05 ,0.01,0.03%,491126951,United States,,618008,Consumer Discretionary,Restaurants
DINO,HF Sinclair Corporation Common Stock,$49.39 ,0,0.00%,9085203228,United States,1960,2070395,Energy,Natural Gas Distribution
DIOD,Diodes Incorporated Common Stock,$50.59 ,-1.42,-2.73%,2346633895,United States,,333109,Technology,Semiconductors
DIS,Walt Disney Company (The) Common Stock,$111.60 ,0.14,0.13%,1.99238E+11,United States,,13055965,Consumer Discretionary,Services-Misc. Amusement & Recreation
DIT,AMCON Distributing Company Common Stock,$112.00 ,-4.01,-3.46%,72879408,United States,1999,310,Consumer Discretionary,Food Distributors
DJCO,Daily Journal Corp. (S.C.) Common Stock,$507.65 ,10.63,2.14%,699250309,United States,,92814,Consumer Discretionary,Newspapers/Magazines
DJT,Trump Media & Technology Group Corp. Common Stock,$10.65 ,-0.26,-2.38%,2981974823,United States,2024,3774056,Technology,Computer Software: Programming Data Processing
DJTWW,Trump Media & Technology Group Corp. Warrants,$4.33 ,-0.05,-1.14%,1212389764,United States,2021,27828,Technology,Computer Software: Programming Data Processing
DK,Delek US Holdings Inc. Common Stock,$34.22 ,0.02,0.06%,2054964144,United States,2017,2311826,Energy,Integrated oil Companies
DKL,Delek Logistics Partners L.P. Common Units representing Limited Partner Interests,$44.75 ,-0.46,-1.02%,2393247945,United States,2012,39611,Energy,Natural Gas Distribution
DKNG,DraftKings Inc. Class A Common Stock,$35.52 ,0.63,1.81%,17680879484,United States,2019,11116543,Consumer Discretionary,Services-Misc. Amusement & Recreation
DKS,Dick's Sporting Goods Inc Common Stock,$213.71 ,-2.98,-1.38%,19227254901,United States,2002,1189254,Consumer Discretionary,Other Specialty Stores
DLB,Dolby Laboratories Common Stock,$67.54 ,-0.1,-0.15%,6450467878,United States,2005,371323,Miscellaneous,Multi-Sector Companies
DLHC,DLH Holdings Corp.,$5.71 ,0.04,0.71%,82755230,United States,,40775,Consumer Discretionary,Professional Services
DLPN,Dolphin Entertainment Inc. Common Stock,$1.61 ,0.01,0.63%,19517099,United States,,18311,Consumer Discretionary,Other Consumer Services
DLR,Digital Realty Trust Inc. Common Stock,$153.63 ,-5.19,-3.27%,52772143434,United States,2004,3459888,Real Estate,Real Estate Investment Trusts
DLR^J,Digital Realty Trust Inc. 5.250% Series J Cumulative Redeemable Preferred Stock,$21.55 ,-0.17,-0.78%,,United States,,12873,,
DLR^K,Digital Realty Trust Inc. 5.850% Series K Cumulative Redeemable Preferred Stock par value $0.01 per share,$24.02 ,-0.1955,-0.81%,,United States,,23764,,
DLR^L,Digital Realty Trust Inc. 5.200% Series L Cumulative Redeemable Preferred Stock,$20.94 ,-0.18,-0.85%,,United States,,26187,,
DLTH,Duluth Holdings Inc. Class B Common Stock,$2.91 ,-0.08,-2.68%,106773074,United States,2015,144578,Consumer Discretionary,Clothing/Shoe/Accessory Stores
DLTR,Dollar Tree Inc. Common Stock,$129.87 ,-0.1,-0.08%,25825063396,United States,1995,2505716,Consumer Discretionary,Department/Specialty Retail Stores
DLX,Deluxe Corporation Common Stock,$22.29 ,-0.03,-0.13%,1003220831,United States,,292496,Consumer Discretionary,Publishing
DLY,DoubleLine Yield Opportunities Fund Common Shares of Beneficial Interest,$14.62 ,0.01,0.07%,700967289,United States,2020,306449,Finance,Investment Managers
DMAA,Drugs Made In America Acquisition Corp. Ordinary Shares,$10.35 ,-0.0077,-0.07%,0,United States,2025,2825,,
DMAAR,Drugs Made In America Acquisition Corp. Rights,$0.19 ,-0.0002,-0.10%,0,United States,2025,38814,Finance,Blank Checks
DMAAU,Drugs Made In America Acquisition Corp. Units,$10.55 ,0,0.00%,0,United States,2025,68,,
DMAC,DiaMedica Therapeutics Inc. Common Stock,$9.39 ,0.05,0.54%,489007152,United States,2018,605975,Health Care,Biotechnology: Pharmaceutical Preparations
DMII,Drugs Made In America Acquisition II Corp. Ordinary Shares,$9.87 ,0,0.00%,0,United States,2025,23977,Finance,Blank Checks
DMIIR,Drugs Made In America Acquisition II Corp. Right,$0.15 ,-0.005,-3.23%,0,United States,2025,6200,Finance,Blank Checks
DMIIU,Drugs Made In America Acquisition II Corp. Unit,$10.01 ,0.01,0.10%,0,United States,2025,1153,,
DMLP,Dorchester Minerals L.P. Common Units Representing Limited Partnership Interests,$22.68 ,0.05,0.22%,1094433606,United States,,150703,Energy,Oil & Gas Production
DMO,Western Asset Mortgage Opportunity Fund Inc. Common Stock,$11.10 ,-0.06,-0.54%,0,United States,2010,100450,Finance,Trusts Except Educational Religious and Charitable
DMRC,Digimarc Corporation Common Stock,$8.69 ,-0.42,-4.61%,189068217,United States,,128039,Technology,EDP Services
DNA,Ginkgo Bioworks Holdings Inc. Class A Common Stock,$9.34 ,-0.56,-5.66%,565912645,United States,2021,892303,Health Care,Biotechnology: Biological Products (No Diagnostic Substances)
DNLI,Denali Therapeutics Inc. Common Stock,$17.98 ,0.61,3.51%,2800719050,United States,2017,1400507,Health Care,Biotechnology: Biological Products (No Diagnostic Substances)
DNMX,Dynamix Corporation III Class A Ordinary Shares,$9.89 ,0,0.00%,0,United States,2025,2,Finance,Blank Checks
DNMXU,Dynamix Corporation III Unit,$10.09 ,-0.01,-0.10%,0,United States,2025,28611,Finance,Blank Checks
DNMXW,Dynamix Corporation III Warrants,$0.37 ,0,0.00%,0,United States,2025,3823,Finance,Blank Checks
DNN,Denison Mines Corp Ordinary Shares (Canada),$2.61 ,-0.15,-5.44%,2341928312,Canada,,50493339,Basic Materials,Other Metals and Minerals
DNOW,DNOW Inc. Common Stock,$14.30 ,0.03,0.21%,1501671114,United States,2014,2206224,Consumer Discretionary,Oil and Gas Field Machinery
DNP,DNP Select Income Fund Inc. Common Stock,$10.01 ,-0.01,-0.10%,0,United States,1987,597200,Finance,Investment Managers
DNTH,Dianthus Therapeutics Inc. Common Stock,$42.13 ,0.5,1.20%,1806366512,United States,2018,520201,Health Care,Biotechnology: Pharmaceutical Preparations
DNUT,Krispy Kreme Inc. Common Stock,$4.40 ,-0.03,-0.68%,753720000,United States,2021,2608397,Consumer Staples,Food Chains
DOC,Healthpeak Properties Inc. Common Stock,$16.62 ,-0.06,-0.36%,11550066058,United States,,6176863,Real Estate,Real Estate Investment Trusts
DOCN,DigitalOcean Holdings Inc. Common Stock,$47.66 ,-1.51,-3.07%,4360515488,United States,2021,1101006,Technology,Computer Software: Programming Data Processing
DOCS,Doximity Inc. Class A Common Stock,$43.85 ,-0.28,-0.63%,8255695146,United States,2021,3097137,Technology,EDP Services
DOCU,DocuSign Inc. Common Stock,$71.11 ,0.88,1.25%,14241394541,United States,1989,2388236,Technology,Computer Software: Prepackaged Software
DOMH,Dominari Holdings Inc. Common Stock,$4.45 ,-0.31,-6.51%,71255336,United States,,411646,Health Care,Biotechnology: Pharmaceutical Preparations
DOMO,Domo Inc. Class B Common Stock,$9.04 ,-0.07,-0.77%,377858368,United States,2018,1430610,Technology,Computer Software: Prepackaged Software
DOO,BRP Inc. Common Subordinate Voting Shares,$77.52 ,0.115,0.15%,5686062208,Canada,,118360,Consumer Discretionary,Industrial Specialties
DORM,Dorman Products Inc. Common Stock,$128.01 ,-0.46,-0.36%,3912324058,United States,,178309,Consumer Discretionary,Auto Parts:O.E.M.
DOUG,Douglas Elliman Inc. Common Stock,$2.83 ,-0.02,-0.70%,251357685,United States,2021,405122,Finance,Real Estate
DOV,Dover Corporation Common Stock,$199.12 ,-2.16,-1.07%,27309949764,United States,,1272303,Industrials,Industrial Machinery/Components
DOW,Dow Inc. Common Stock ,$23.97 ,-0.61,-2.48%,17037094386,United States,2019,9611529,Industrials,Major Chemicals
DPG,Duff & Phelps Utility and Infrastructure Fund Inc.,$12.55 ,0,0.00%,0,United States,2011,137827,Finance,Trusts Except Educational Religious and Charitable
DPRO,Draganfly Inc. Common Shares,$6.97 ,-0.52,-6.94%,162129254,Canada,,1009516,Industrials,Aerospace
DPZ,Domino's Pizza Inc Common Stock,$431.73 ,-1.94,-0.45%,14586523897,United States,2004,552922,Consumer Discretionary,Food Distributors
DRCT,Direct Digital Holdings Inc. Class A Common Stock,$0.07 ,-0.0053,-6.77%,2190535,United States,2022,8703767,Consumer Discretionary,Advertising
DRDB,Roman DBDR Acquisition Corp. II Ordinary shares,$10.43 ,-0.02,-0.19%,0,United States,2025,19783,,
DRDBU,Roman DBDR Acquisition Corp. II Unit,$10.62 ,0,0.00%,0,United States,2024,7,,
DRDBW,Roman DBDR Acquisition Corp. II Warrants,$0.70 ,-0.09,-11.39%,0,United States,2025,1520,,
DRH,Diamondrock Hospitality Company Common Stock,$9.24 ,0.18,1.99%,1882217402,United States,2005,4163014,Real Estate,Real Estate Investment Trusts
DRH^A,Diamondrock Hospitality Company 8.250% Series A Cumulative Redeemable Preferred Stock,$25.44 ,0,0.00%,,United States,,7684,,
DRI,Darden Restaurants Inc. Common Stock,$182.28 ,-1.02,-0.56%,21201672537,United States,,1584306,Consumer Discretionary,Restaurants
DRMA,Dermata Therapeutics Inc. Common Stock,$2.63 ,-0.12,-4.36%,2699582,United States,2021,55012,Health Care,Biotechnology: Pharmaceutical Preparations
DRMAW,Dermata Therapeutics Inc. Warrant,$0.02 ,-0.0014,-6.97%,19195,United States,2021,6329,Health Care,Biotechnology: Pharmaceutical Preparations
DRUG,Bright Minds Biosciences Inc. Common Stock,$84.19 ,-4.82,-5.42%,596455757,Canada,,84174,Health Care,Biotechnology: Pharmaceutical Preparations
DRVN,Driven Brands Holdings Inc. Common Stock,$15.41 ,-0.1,-0.65%,2534239499,United States,2021,863955,Consumer Discretionary,Automotive Aftermarket
DSGN,Design Therapeutics Inc. Common Stock,$9.43 ,0.19,2.06%,537168229,United States,2021,210918,Health Care,Biotechnology: Pharmaceutical Preparations
DSGR,Distribution Solutions Group Inc. Common Stock,$29.14 ,0.02,0.07%,1347077626,United States,,64496,Consumer Discretionary,Industrial Specialties
DSGX,Descartes Systems Group Inc. (The) Common Stock,$90.71 ,-1.53,-1.66%,7799864714,Canada,,396034,Technology,Computer Software: Prepackaged Software
DSL,DoubleLine Income Solutions Fund Common Shares of Beneficial Interests,$11.24 ,-0.03,-0.27%,1146444347,United States,2013,666152,Finance,Trusts Except Educational Religious and Charitable
DSM,BNY Mellon Strategic Municipal Bond Fund Inc. Common Stock,$5.99 ,-0.03,-0.50%,0,United States,1989,174327,Finance,Investment Managers
DSP,Viant Technology Inc. Class A Common Stock,$11.68 ,-0.03,-0.26%,729224518,United States,2021,311328,Technology,Computer Software: Programming Data Processing
DSS,DSS Inc. Common Stock,$0.98 ,-0.0299,-2.96%,8911577,United States,,3438,Consumer Discretionary,Containers/Packaging
DSU,Blackrock Debt Strategies Fund Inc. Common Stock,$10.15 ,-0.02,-0.20%,0,United States,1998,318199,Finance,Finance Companies
DT,Dynatrace Inc. Common Stock,$46.04 ,0.76,1.68%,13880519997,United States,2019,2929946,Technology,Computer Software: Prepackaged Software
DTB,DTE Energy Company 2020 Series G 4.375% Junior Subordinated Debentures due 2080,$17.31 ,-0.11,-0.63%,3594992938,United States,2020,31734,Utilities,Electric Utilities: Central
DTE,DTE Energy Company Common Stock,$129.80 ,-0.95,-0.73%,26957254958,United States,,1780075,Utilities,Electric Utilities: Central
DTF,DTF Tax-Free Income 2028 Term Fund Inc. Common Stock,$11.36 ,-0.015,-0.13%,79855881,United States,1991,2445,Finance,Investment Managers
DTG,DTE Energy Company 2021 Series E 4.375% Junior Subordinated Debentures,$17.22 ,-0.11,-0.64%,3576301467,United States,2021,41329,Utilities,Electric Utilities: Central
DTI,Drilling Tools International Corporation Common Stock,$2.66 ,-0.21,-7.32%,93628749,United States,2021,235475,Consumer Discretionary,Oil and Gas Field Machinery
DTIL,Precision BioSciences Inc. Common Stock,$4.99 ,0.07,1.42%,66151187,United States,2019,136773,Health Care,Biotechnology: Biological Products (No Diagnostic Substances)
DTK,DTE Energy Company 2025 Series H 6.25% Junior Subordinated Debentures due 2085,$25.05 ,-0.16,-0.64%,0,United States,2025,147313,Utilities,Electric Utilities: Central
DTM,DT Midstream Inc. Common Stock ,$121.00 ,1.48,1.24%,12302544925,United States,2021,1381637,Utilities,Natural Gas Distribution
DTSQ,DT Cloud Star Acquisition Corporation Ordinary Shares,$10.94 ,0.135,1.25%,0,United States,2024,14974,,
DTSQR,DT Cloud Star Acquisition Corporation Right,$0.18 ,-0.0049,-2.61%,0,United States,2024,10610,,
DTSQU,DT Cloud Star Acquisition Corporation Units,$10.87 ,0,0.00%,0,United States,2024,36,,
DTST,Data Storage Corporation Common Stock,$5.00 ,-0.03,-0.60%,37491790,United States,,140685,Technology,EDP Services
DTSTW,Data Storage Corporation Warrant,$0.20 ,-0.0426,-17.76%,1479426,United States,,9210,Technology,EDP Services
DTW,DTE Energy Company 2017 Series E 5.25% Junior Subordinated Debentures due 2077,$21.49 ,-0.25,-1.15%,4463107928,United States,2017,36083,Utilities,Electric Utilities: Central
DUK,Duke Energy Corporation (Holding Company) Common Stock,$115.30 ,0.91,0.80%,89664339127,United States,,2955664,Utilities,Power Generation
DUK^A,Duke Energy Corporation Depositary Shares each representing a 1/1000th interest in a share of 5.75% Series A Cumulative Redeemable Perpetual Preferred Stock,$25.01 ,-0.08,-0.32%,,United States,,37473,,
DUKB,Duke Energy Corporation 5.625% Junior Subordinated Debentures due 2078,$24.68 ,-0.58,-2.30%,19192679008,United States,2018,25718,Utilities,Power Generation
DUOL,Duolingo Inc. Class A Common Stock,$196.28 ,-4.68,-2.33%,9073505632,United States,2021,1614027,Technology,Computer Software: Prepackaged Software
DUOT,Duos Technologies Group Inc. Common Stock,$9.79 ,-0.58,-5.59%,199865670,United States,,110787,Technology,Computer Software: Prepackaged Software
DV,DoubleVerify Holdings Inc. Common Stock,$10.94 ,-0.04,-0.36%,1762512921,United States,2021,2222758,Technology,Computer Software: Programming Data Processing
DVA,DaVita Inc. Common Stock,$121.35 ,1.02,0.85%,8567310000,United States,,775880,Health Care,Misc Health and Biotechnology Services
DVAX,Dynavax Technologies Corporation Common Stock,$10.80 ,-0.06,-0.55%,1268189654,United States,2004,1066655,Health Care,Biotechnology: Pharmaceutical Preparations
DVLT,Datavault AI Inc. Common Stock,$1.38 ,-0.06,-4.17%,393599664,United States,2018,21473454,Technology,Semiconductors
DVN,Devon Energy Corporation Common Stock,$37.52 ,-0.02,-0.05%,23536296000,United States,1985,7098204,Energy,Oil & Gas Production
DWSN,Dawson Geophysical Company Common Stock,$1.76 ,0,0.00%,54644130,United States,,15752,Energy,Oil & Gas Production
DWTX,Dogwood Therapeutics Inc. Common Stock,$6.82 ,0.4,6.23%,211821869,United States,2020,74991,Health Care,Biotechnology: Pharmaceutical Preparations
DX,Dynex Capital Inc. Common Stock,$13.53 ,0.01,0.07%,1986498210,United States,,3555152,Real Estate,Real Estate Investment Trusts
DX^C,Dynex Capital Inc. 6.900% Series C Fixed-to-Floating Rate Cumulative Redeemable Preferred Stock,$25.98 ,0.0536,0.21%,,United States,,8870,,
DXC,DXC Technology Company Common Stock ,$15.17 ,-0.07,-0.46%,2641611976,United States,,2956866,Technology,EDP Services
DXCM,DexCom Inc. Common Stock,$66.96 ,-1.98,-2.87%,26115489573,United States,2005,6832330,Health Care,Medical/Dental Instruments
DXLG,Destination XL Group Inc. Common Stock,$1.14 ,-0.42,-26.92%,61426794,United States,,907165,Consumer Discretionary,Clothing/Shoe/Accessory Stores
DXPE,DXP Enterprises Inc. Common Stock,$109.36 ,0.71,0.65%,1714687154,United States,,224173,Industrials,Industrial Machinery/Components
DXR,Daxor Corporation Common Stock,$12.25 ,-0.0799,-0.65%,59290484,United States,,739,Health Care,Medical/Dental Instruments
DY,Dycom Industries Inc. Common Stock,$345.78 ,-18.73,-5.14%,10012423315,United States,,475568,Industrials,Water Sewer Pipeline Comm & Power Line Construction
DYAI,Dyadic International Inc. Common Stock,$0.91 ,-0.013,-1.41%,32952609,United States,,31286,Health Care,Biotechnology: Biological Products (No Diagnostic Substances)
DYN,Dyne Therapeutics Inc. Common Stock,$19.27 ,-0.15,-0.77%,3113911100,United States,2020,4454139,Health Care,Biotechnology: Pharmaceutical Preparations
DYOR,Insight Digital Partners II Class A Ordinary Shares,$9.90 ,0,0.00%,0,United States,2025,23061,Finance,Blank Checks
DYORU,Insight Digital Partners II Units,$10.06 ,0,0.00%,0,United States,2025,43,Finance,Blank Checks
DYORW,Insight Digital Partners II Warrants,$0.37 ,0.039,11.82%,0,United States,2025,13602,Finance,Blank Checks
EA,Electronic Arts Inc. Common Stock,$203.73 ,0.07,0.03%,50811191416,United States,,2269858,Consumer Discretionary,Services-Misc. Amusement & Recreation
EAD,Allspring Income Opportunities Fund Common Shares,$6.77 ,-0.02,-0.30%,0,United States,2003,161632,Finance,Finance/Investors Services
EAF,GrafTech International Ltd. Common Stock,$17.01 ,-0.76,-4.28%,439200071,United States,2018,101886,Energy,Industrial Machinery/Components
EAI,Entergy Arkansas LLC First Mortgage Bonds 4.875% Series Due September 1 2066,$21.14 ,-0.06,-0.28%,9441058551,United States,2016,35180,Utilities,Electric Utilities: Central
EARN,Ellington Credit Company Common Shares of Beneficial Interest,$5.17 ,0.04,0.78%,194181038,United States,2013,214328,Real Estate,Real Estate Investment Trusts
EAT,Brinker International Inc. Common Stock,$144.45 ,1.92,1.35%,6418089007,United States,,1000902,Consumer Discretionary,Restaurants
EB,Eventbrite Inc. Class A Common Stock,$4.43 ,-0.01,-0.23%,432700941,United States,2018,1351245,Technology,Computer Software: Programming Data Processing
EBAY,eBay Inc. Common Stock,$85.36 ,0.96,1.14%,38582720000,United States,1998,3896438,Real Estate,Real Estate
EBC,Eastern Bankshares Inc. Common Stock,$19.65 ,-0.08,-0.41%,4142179325,United States,2020,1894676,Finance,Savings Institutions
EBF,Ennis Inc. Common Stock,$18.36 ,0.13,0.71%,470562228,United States,,205971,Consumer Discretionary,Office Equipment/Supplies/Services
EBMT,Eagle Bancorp Montana Inc. Common Stock,$19.09 ,0.445,2.39%,151767298,United States,2010,56426,Finance,Major Banks
EBS,Emergent BioSolutions Inc. Common Stock,$11.41 ,-0.31,-2.65%,599252789,United States,2006,568089,Health Care,Biotechnology: Pharmaceutical Preparations
ECAT,BlackRock ESG Capital Allocation Term Trust Common Shares of Beneficial Interest,$15.74 ,-0.05,-0.32%,1702044900,United States,2021,308767,Finance,Trusts Except Educational Religious and Charitable
ECBK,ECB Bancorp Inc. Common Stock,$17.20 ,0.09,0.53%,151306508,United States,2022,13932,Finance,Banks
ECC           ,Eagle Point Credit Company Inc. Common Stock,$5.53 ,-0.12,-2.12%,335463758,United States,2014,2535576,Finance,Trusts Except Educational Religious and Charitable
ECC^D,Eagle Point Credit Company Inc. 6.75% Series D Preferred Stock,$19.20 ,0.01,0.05%,,United States,,18712,,
ECCC,Eagle Point Credit Company Inc. 6.50% Series C Term Preferred Stock due 2031,$24.55 ,0.15,0.62%,1489264964,United States,,4350,Finance,Trusts Except Educational Religious and Charitable
ECCF,Eagle Point Credit Company Inc. 8.00% Series F Term Preferred Stock due 2029,$25.05 ,-0.055,-0.22%,27271254341,United States,,13592,,
ECCU,Eagle Point Credit Company Inc. 7.75% Notes due 2030,$25.41 ,0.1,0.40%,0,United States,2024,30435,,
ECCV,Eagle Point Credit Company Inc. 5.375% Notes due 2029,$23.77 ,0.148,0.63%,1441948195,United States,2022,18449,Finance,Trusts Except Educational Religious and Charitable
ECCW,Eagle Point Credit Company Inc. 6.75% Notes due 2031,$24.74 ,0.04,0.16%,1500790844,United States,2021,8669,Finance,Trusts Except Educational Religious and Charitable
ECCX,Eagle Point Credit Company Inc. 6.6875% Notes due 2028,$25.02 ,-0.13,-0.52%,1517776350,United States,2022,1218,Finance,Trusts Except Educational Religious and Charitable
ECDA,ECD Automotive Design Inc. Common Stock,$0.29 ,-0.003,-1.02%,724146,United States,2022,4164143,Industrials,Auto Manufacturing
ECDAW,ECD Automotive Design Inc. Warrant ,$0.01 ,0,0.00%,24971,United States,2022,3864,Industrials,Auto Manufacturing
ECF,Ellsworth Growth and Income Fund Ltd.,$11.95 ,0.03,0.25%,0,United States,1986,26574,Finance,Finance/Investors Services
ECF^A,Ellsworth Growth and Income Fund Ltd. 5.25% Series A Cumulative Preferred Shares (Liquidation Preference $25.00 per share),$21.80 ,0,0.00%,,United States,,6,,
ECG,Everus Construction Group Inc. Common Stock,$88.09 ,-13.12,-12.96%,4493169192,United States,2024,1713938,Consumer Discretionary,Homebuilding
ECL,Ecolab Inc. Common Stock,$263.60 ,2.27,0.87%,74660918131,United States,,1357367,Consumer Discretionary,Package Goods/Cosmetics
ECOR,electroCore Inc. Common Stock,$4.75 ,-0.07,-1.45%,37980539,United States,2018,23281,Health Care,Biotechnology: Electromedical & Electrotherapeutic Apparatus
ECPG,Encore Capital Group Inc Common Stock,$53.71 ,-2.17,-3.88%,1197930438,United States,,161796,Finance,Finance Companies
ECVT,Ecovyst Inc. Common Stock,$9.16 ,-0.12,-1.29%,1044417832,United States,2017,1230849,Industrials,Major Chemicals
ED,Consolidated Edison Inc. Common Stock,$97.53 ,1.89,1.98%,35202049848,United States,,2638216,Utilities,Power Generation
EDBL,Edible Garden AG Incorporated Common Stock,$1.30 ,0.05,4.00%,6664652,United States,2022,133410,Consumer Staples,Farming/Seeds/Milling
EDBLW,Edible Garden AG Incorporated Warrant,$0.18 ,0.009,5.42%,897165,United States,2022,6136,Consumer Staples,Farming/Seeds/Milling
EDD,Morgan Stanley Emerging Markets Domestic Debt Fund Inc. Common Stock,$5.52 ,-0.02,-0.36%,0,United States,2007,231742,Finance,Finance Companies
