Symbol,Name,Last Sale,Net Change,% Change,Market Cap,Country,IPO Year,Volume,Sector,Industry
PNRG,PrimeEnergy Resources Corporation Common Stock,$173.34 ,-11.175,-6.06%,283402725,United States,,55836,Energy,Oil & Gas Production
PNTG,The Pennant Group Inc. Common Stock ,$29.72 ,0.21,0.71%,1028125358,United States,,291906,Health Care,Medical/Nursing Services
PNW,Pinnacle West Capital Corporation Common Stock,$87.81 ,1.06,1.22%,10510013936,United States,,1188803,Utilities,Electric Utilities: Central
POCI,Precision Optics Corporation Inc. Common stock,$4.15 ,-0.02,-0.48%,32016009,United States,,17837,Health Care,Biotechnology: Electromedical & Electrotherapeutic Apparatus
PODC,PodcastOne Inc. Common Stock,$2.39 ,0.1,4.37%,64316652,United States,,25406,Technology,Computer Software: Programming Data Processing
PODD,Insulet Corporation Common Stock,$295.70 ,1.53,0.52%,20801577739,United States,2007,576607,Health Care,Medical/Dental Instruments
POET,POET Technologies Inc. Common Shares,$6.50 ,-0.72,-9.97%,591568887,Canada,,10777085,Technology,Semiconductors
POLA,Polar Power Inc. Common Stock,$2.23 ,-0.04,-1.76%,5928847,United States,2016,17279,Miscellaneous,Industrial Machinery/Components
POLE,Andretti Acquisition Corp. II Class A Ordinary Shares,$10.50 ,-0.02,-0.19%,0,United States,2024,903,,
POLEU,Andretti Acquisition Corp. II Unit,$11.35 ,0.75,7.08%,0,United States,2024,161,,
POLEW,Andretti Acquisition Corp. II Warrant,$0.30 ,-0.03,-9.09%,0,United States,2024,9020,,
POOL,Pool Corporation Common Stock,$240.27 ,-0.02,-0.01%,8949933521,United States,1995,486313,Consumer Discretionary,Industrial Specialties
POR,Portland General Electric Co Common Stock,$48.13 ,0.61,1.28%,5414093260,United States,,1317220,Utilities,Electric Utilities: Central
POST,Post Holdings Inc. Common Stock,$98.74 ,1.16,1.19%,5149764755,United States,2012,740201,Consumer Staples,Packaged Foods
POWI,Power Integrations Inc. Common Stock,$36.47 ,-0.88,-2.36%,2018109828,United States,1997,770006,Technology,Semiconductors
POWL,Powell Industries Inc. Common Stock,$337.07 ,-25.67,-7.08%,4075878417,United States,,218581,Energy,Electrical Products
POWW,Outdoor Holding Company Common Stock,$1.98 ,0,0.00%,231879437,United States,,324777,Industrials,Ordnance And Accessories
POWWP,Outdoor Holding Company 8.75% Series A Cumulative Redeemable Perpetual Preferred Stock,$24.10 ,0.09,0.38%,2822370931,United States,,1200,Industrials,Ordnance And Accessories
PPC,Pilgrim's Pride Corporation Common Stock,$39.97 ,0.27,0.68%,9494771457,United States,,708888,Consumer Staples,Meat/Poultry/Fish
PPG,PPG Industries Inc. Common Stock,$103.54 ,0.78,0.76%,23234376000,United States,,1708481,Consumer Discretionary,Paints/Coatings
PPIH,Perma-Pipe International Holdings Inc. Common Stock,$32.59 ,3.3,11.27%,263784927,United States,,286206,Industrials,Pollution Control Equipment
PPL,PPL Corporation Common Stock,$33.99 ,0.53,1.58%,25143734626,United States,,5978012,Utilities,Electric Utilities: Central
PPSI,Pioneer Power Solutions Inc. Common Stock,$4.14 ,0.02,0.49%,45934401,United States,,29587,Industrials,Electrical Products
PPT,Putnam Premier Income Trust Common Stock,$3.53 ,-0.03,-0.84%,351334768,United States,1988,200806,Finance,Finance Companies
PPTA,Perpetua Resources Corp. Common Shares,$28.84 ,-0.31,-1.06%,3514808149,Canada,,3033571,Basic Materials,Precious Metals
PR,Permian Resources Corporation Class A Common Stock,$14.60 ,-0.07,-0.48%,12107744843,United States,2022,7237797,Energy,Oil & Gas Production
PRA,ProAssurance Corporation Common Stock,$24.26 ,0.1,0.41%,1247294979,United States,,594259,Finance,Property-Casualty Insurers
PRAA,PRA Group Inc. Common Stock,$17.38 ,-0.63,-3.50%,678088382,United States,2002,440311,Finance,Finance: Consumer Services
PRAX,Praxis Precision Medicines Inc. Common Stock,$268.80 ,1.52,0.57%,6721927565,United States,2020,403016,Health Care,Biotechnology: Pharmaceutical Preparations
PRCH,Porch Group Inc. Common Stock,$9.92 ,-0.55,-5.25%,1226940925,United States,2020,1501547,Technology,Computer Software: Prepackaged Software
PRCT,PROCEPT BioRobotics Corporation Common Stock,$35.99 ,-0.04,-0.11%,2011070418,United States,2021,1261767,Health Care,Medical/Dental Instruments
PRDO,Perdoceo Education Corporation Common Stock,$28.87 ,0.16,0.56%,1856989882,United States,,827031,Real Estate,Other Consumer Services
PRG,PROG Holdings Inc. Common Stock,$30.36 ,-0.28,-0.91%,1200604203,United States,,374906,Consumer Discretionary,Diversified Commercial Services
PRGO,Perrigo Company plc Ordinary Shares,$13.14 ,-0.29,-2.16%,1808379478,United States,,2483166,Health Care,Biotechnology: Pharmaceutical Preparations
PRGS,Progress Software Corporation Common Stock (DE),$44.80 ,-0.3,-0.67%,1922259270,United States,1991,332656,Technology,Computer Software: Prepackaged Software
PRH,Prudential Financial Inc. 5.950% Junior Subordinated Notes due 2062,$24.60 ,-0.16,-0.65%,8659200000,United States,2022,17328,Finance,Life Insurance
PRHI,Presurance Holdings Inc. Common Stock,$1.09 ,0.155,16.67%,13261826,United States,2015,566932,Finance,Property-Casualty Insurers
PRHIZ,Presurance Holdings Inc. 9.75% Senior Unsecured Notes due 2028,$19.20 ,0,0.00%,234679315,United States,,26,Finance,Property-Casualty Insurers
PRI,Primerica Inc. Common Stock,$258.08 ,2.21,0.86%,8236896249,United States,2010,298917,Finance,Life Insurance
PRIM,Primoris Services Corporation Common Stock,$126.28 ,-10.71,-7.82%,6823205284,United States,,1647710,Industrials,Water Sewer Pipeline Comm & Power Line Construction
PRK,Park National Corporation Common Stock,$164.24 ,0.43,0.26%,2640693751,United States,1994,46654,Finance,Major Banks
PRKS,United Parks & Resorts Inc. Common Stock,$36.64 ,-0.54,-1.45%,1998734387,United States,2013,655645,Health Care,Biotechnology: Electromedical & Electrotherapeutic Apparatus
PRLB,Proto Labs Inc. Common stock,$52.57 ,-0.65,-1.22%,1244791625,United States,2012,84715,Industrials,Metal Fabrications
PRLD,Prelude Therapeutics Incorporated Common Stock,$1.71 ,0.08,4.91%,107499612,United States,2020,341422,Health Care,Biotechnology: Pharmaceutical Preparations
PRMB,Primo Brands Corporation Class A Common Stock,$16.44 ,0.36,2.24%,6010978309,United States,2024,6925273,Consumer Staples,Beverages (Production/Distribution)
PRME,Prime Medicine Inc. Common Stock,$4.10 ,-0.17,-3.98%,740093698,United States,2022,2178377,Health Care,Biotechnology: Biological Products (No Diagnostic Substances)
PROF,Profound Medical Corp. Common Stock,$7.33 ,-0.1,-1.35%,220191800,Canada,,62290,Health Care,Medical/Dental Instruments
PROK,ProKidney Corp. Class A Ordinary Shares,$2.21 ,-0.01,-0.45%,664843978,United States,2021,818701,Health Care,Biotechnology: Biological Products (No Diagnostic Substances)
PROP,Prairie Operating Co. Common Stock,$1.71 ,-0.05,-2.84%,101995703,United States,,2142841,Finance,Finance: Consumer Services
PROV,Provident Financial Holdings Inc. Common Stock,$15.81 ,-0.08,-0.50%,102357576,United States,,7115,Finance,Savings Institutions
PRPH,ProPhase Labs Inc. Common Stock (DE),$0.11 ,-0.0228,-16.57%,5301351,United States,,4542708,Health Care,Biotechnology: Pharmaceutical Preparations
PRPL,Purple Innovation Inc. Common Stock,$0.82 ,-0.0195,-2.31%,89242230,United States,2015,172092,Consumer Discretionary,Home Furnishings
PRPO,Precipio Inc.  Common Stock,$24.97 ,0.016,0.06%,43747615,United States,,6388,Industrials,Biotechnology: Laboratory Analytical Instruments
PRS,Prudential Financial Inc. 5.625% Junior Subordinated Notes due 2058,$23.97 ,-0.17,-0.70%,8437440000,United States,2018,27958,Finance,Life Insurance
PRSO,Peraso Inc. Common Stock,$1.04 ,-0.07,-6.31%,10802386,United States,,210481,Technology,Semiconductors
PRSU,Pursuit Attractions and Hospitality Inc. Common Stock,$35.86 ,0.26,0.73%,1014237847,United States,,199168,Real Estate,Real Estate
PRT,PermRock Royalty Trust Units of Beneficial Interest,$3.84 ,-0.02,-0.52%,46716411,United States,2018,26733,Energy,Oil & Gas Production
PRTA,Prothena Corporation plc Ordinary Shares,$10.36 ,0.03,0.29%,557678614,United States,,477695,Health Care,Biotechnology: Pharmaceutical Preparations
PRTC,PureTech Health plc American Depositary Shares,$16.91 ,0,0.00%,408687712,United States,,481,Health Care,Biotechnology: Pharmaceutical Preparations
PRTH,Priority Technology Holdings Inc. Common Stock,$5.77 ,-0.05,-0.86%,472398947,United States,2016,293084,Real Estate,Real Estate
PRTS,CarParts.com Inc. Common Stock,$0.41 ,-0.0157,-3.65%,28861692,United States,2007,1130459,Consumer Discretionary,Auto & Home Supply Stores
PRU,Prudential Financial Inc. Common Stock,$116.96 ,-0.09,-0.08%,45581165933,United States,2001,1673326,Finance,Life Insurance
PRVA,Privia Health Group Inc. Common Stock,$24.91 ,0.09,0.36%,3063968087,United States,2021,694616,Health Care,Medical/Nursing Services
PSA,Public Storage Common Stock,$274.97 ,1.26,0.46%,48247064960,United States,,1175068,Real Estate,Real Estate Investment Trusts
PSA^F,Public Storage Depositary Shares Each Representing 1/1000 of a 5.15% Cumulative Preferred Share of Beneficial Interest Series F par value $0.01 per share,$21.36 ,-0.12,-0.56%,,United States,,8875,,
PSA^G,Public Storage Depositary Shares Each Representing 1/1000 of a 5.05% Cumulative Preferred Share of Beneficial Interest Series G,$20.66 ,-0.14,-0.67%,,United States,,13851,,
PSA^H,Public Storage Depositary Shares Each Representing 1/1000 of a  5.60% Cumulative Preferred  Share of Beneficial Interest Series H,$23.44 ,-0.24,-1.01%,,United States,,17779,,
PSA^I,Public Storage Depositary Shares Each Representing 1/1000 of a 4.875% Cumulative Preferred Share of Beneficial Interest Series I par value $0.01 per share,$19.73 ,-0.26,-1.30%,,United States,,34308,,
PSA^J,Public Storage Depositary Shares Each Representing 1/1000 of a 4.700% Cumulative Preferred Share of Beneficial Interest Series J par value $0.01 per share,$19.05 ,-0.12,-0.63%,,United States,,12844,,
PSA^K,Public Storage Depositary Shares Each Representing 1/1000 of a 4.75% Cumulative Preferred Share of Beneficial Interest Series K,$19.31 ,-0.1,-0.52%,,United States,,17801,,
PSA^L,Public Storage Depositary Shares Each Representing 1/1000 of a 4.625% Cumulative Preferred Share of Beneficial Interest Series L par value $0.01 per share,$18.90 ,-0.13,-0.68%,,United States,,82239,,
PSA^M,Public Storage Depositary Shares Each Representing 1/1000 of a 4.125% Cumulative Preferred Share of Beneficial Interest Series M,$16.85 ,0,0.00%,,United States,,15447,,
PSA^N,Public Storage Depositary Shares Each Representing 1/1000 of a 3.875% Cumulative Preferred Share of Beneficial Interest Series N,$15.72 ,-0.08,-0.51%,,United States,,23472,,
PSA^O,Public Storage Depositary Shares Each Representing 1/1000 of a 3.900% Cumulative Preferred Share of Beneficial Interest Series O,$15.86 ,-0.03,-0.19%,,United States,,17166,,
PSA^P,Public Storage Depositary Shares Each Representing 1/1000 of a 4.000% Cumulative Preferred Share of Bene cial Interest Series P,$16.16 ,-0.14,-0.86%,,United States,,62765,,
PSA^Q,Public Storage Depositary Shares Each Representing 1/1000 of a 3.950% Cumulative Preferred Share of Beneficial Interest Series Q par value $0.01 per share,$16.05 ,-0.085,-0.53%,,United States,,13184,,
PSA^R,Public Storage Depositary Shares Each Representing 1/1000 of a 4.00% Cumulative Preferred Share of Bene cial Interest Series R,$16.17 ,-0.14,-0.86%,,United States,,31390,,
PSA^S,Public Storage Depositary Shares Each Representing 1/1000 of a 4.100% Cumulative Preferred Share of Beneficial Interest Series S,$16.61 ,-0.12,-0.72%,,United States,,31018,,
PSEC,Prospect Capital Corporation Common Stock,$2.62 ,-0.02,-0.76%,1233786794,United States,2004,3119819,Finance,Finance: Consumer Services
PSEC^A,Prospect Capital Corporation 5.35% Series A Fixed Rate Cumulative Perpetual Preferred Stock,$16.83 ,0.131,0.78%,,United States,,4419,,
PSIX,Power Solutions International Inc. Common Stock,$62.95 ,-2.81,-4.27%,1450426544,United States,,541029,Industrials,Industrial Machinery/Components
PSKY,Paramount Skydance Corporation Class B Common Stock,$13.74 ,-0.38,-2.69%,15157514264,United States,,10230198,Industrials,Broadcasting
PSMT,PriceSmart Inc. Common Stock,$128.52 ,-2.5,-1.91%,3969824849,United States,,172306,Consumer Discretionary,Department/Specialty Retail Stores
PSN,Parsons Corporation Common Stock,$63.33 ,-2.56,-3.89%,6743921898,United States,2019,2149137,Technology,EDP Services
PSNL,Personalis Inc. Common Stock,$8.77 ,-0.51,-5.50%,778814132,United States,2019,4338787,Health Care,Medical Specialities
PSO,Pearson Plc Common Stock,$13.95 ,0.01,0.07%,8869032485,United Kingdom,,631088,Consumer Discretionary,Books
PSTG,Pure Storage Inc. Class A Common Stock,$71.32 ,-4.55,-6.00%,23547842007,United States,2015,5275320,Technology,Electronic Components
PSTL,Postal Realty Trust Inc. Class A Common Stock,$15.44 ,0.34,2.25%,402407100,United States,2019,144143,Real Estate,Real Estate Investment Trusts
PSTV,PLUS THERAPEUTICS Inc. Common Stock ,$0.68 ,-0.0362,-5.03%,93973988,United States,,5978805,Health Care,Medical/Dental Instruments
PSX,Phillips 66 Common Stock,$141.44 ,-1.99,-1.39%,56989165334,United States,,1932229,Energy,Integrated oil Companies
PTA,Cohen & Steers Tax-Advantaged Preferred Securities and Income Fund Common Shares of Beneficial Interest,$19.24 ,-0.14,-0.72%,1063461313,United States,2020,236632,Finance,Trusts Except Educational Religious and Charitable
PTC,PTC Inc. Common Stock,$176.00 ,-2,-1.12%,21022893936,United States,,1177414,Technology,Computer Software: Prepackaged Software
PTCT,PTC Therapeutics Inc. Common Stock,$75.64 ,0.2,0.27%,6073007390,United States,2013,941260,Health Care,Biotechnology: Pharmaceutical Preparations
PTEN,Patterson-UTI Energy Inc. Common Stock,$6.21 ,-0.14,-2.21%,2355092969,United States,1993,5732873,Energy,Oil & Gas Production
PTGX,Protagonist Therapeutics Inc. Common Stock,$95.35 ,3.1,3.36%,5960868753,United States,2016,1286845,Health Care,Biotechnology: Pharmaceutical Preparations
PTIX,Protagenic Therapeutics Inc. Common Stock,$1.65 ,0.07,4.43%,3192549,United States,,112850,Health Care,Biotechnology: Pharmaceutical Preparations
PTIXW,Protagenic Therapeutics Inc. Warrant,$0.02 ,-0.0035,-17.07%,32893,United States,,497,Health Care,Biotechnology: Pharmaceutical Preparations
PTLO,Portillo's Inc. Class A Common Stock,$4.69 ,-0.04,-0.85%,353507104,United States,2021,2139821,Consumer Discretionary,Restaurants
PTN,Palatin Technologies Inc. Common Stock,$27.25 ,2.58,10.46%,46397894,United States,,43230,Health Care,Biotechnology: Pharmaceutical Preparations
PTON,Peloton Interactive Inc. Class A Common Stock,$6.54 ,-0.25,-3.68%,2732454327,United States,2019,8643498,Consumer Discretionary,Recreational Games/Products/Toys
PTRN,Pattern Group Inc. Series A Common Stock,$12.72 ,-0.03,-0.24%,1965525093,United States,2025,416421,Consumer Discretionary,Catalog/Specialty Distribution
PTY,Pimco Corporate & Income Opportunity Fund,$12.92 ,-0.06,-0.46%,0,United States,2002,1178965,Finance,Investment Managers
PUBM,PubMatic Inc. Class A Common Stock,$9.05 ,-0.28,-3.00%,420053958,United States,2020,437590,Technology,Computer Software: Programming Data Processing
PUK,Prudential Public Limited Company Common Stock,$29.10 ,-0.44,-1.49%,37178726897,United Kingdom,,599702,Finance,Life Insurance
PULM,Pulmatrix Inc. Common Stock,$4.58 ,0.62,15.66%,16727465,United States,2014,34978,Health Care,Biotechnology: Pharmaceutical Preparations
PUMP,ProPetro Holding Corp. Common Stock,$10.24 ,-0.9,-8.08%,1064777533,United States,2017,4439423,Energy,Oilfield Services/Equipment
PURR,Hyperliquid Strategies Inc Common Stock,$3.50 ,0.08,2.34%,444589471,United States,,1983687,Health Care,Biotechnology: Pharmaceutical Preparations
PVH,PVH Corp. Common Stock,$75.27 ,-2,-2.59%,3447568928,United States,,774882,Industrials,Garments and Clothing
PVL,Permianville Royalty Trust Units of Beneficial Interest,$1.79 ,-0.06,-3.24%,59070000,United States,2011,52689,Energy,Oil & Gas Production
PVLA,Palvella Therapeutics Inc. Common Stock,$98.58 ,1.8,1.86%,1166841184,United States,,192730,Health Care,Biotechnology: Pharmaceutical Preparations
PW,Power REIT (MD) Common Stock,$1.00 ,0.0299,3.08%,3389661,United States,1998,423235,Real Estate,Real Estate Investment Trusts
PW^A,Power REIT 7.75% Series A Cumulative Perpetual Preferred Stock,$5.00 ,0,0.00%,,United States,,1542,,
PWP,Perella Weinberg Partners Class A Common Stock,$17.81 ,-0.63,-3.42%,1581686901,United States,2020,859814,Finance,Finance: Consumer Services
PWR,Quanta Services Inc. Common Stock,$438.11 ,-28.8,-6.17%,65329161254,United States,,1496952,Industrials,Engineering & Construction
PX,P10 Inc. Class A Common Stock,$10.27 ,-0.11,-1.06%,1129854974,United States,2021,599576,Finance,Investment Managers
PXLW,Pixelworks Inc.  Common Stock,$6.06 ,-0.5,-7.62%,38138883,United States,2000,99680,Technology,Semiconductors
PYPL,PayPal Holdings Inc. Common Stock,$61.66 ,-0.03,-0.05%,57692299422,United States,,15957465,Industrials,Diversified Commercial Services
PYT,PPlus Tr GSC-2 Tr Ctf Fltg Rate,$23.44 ,0.07,0.30%,0,United States,,275,Finance,Finance: Consumer Services
PYXS,Pyxis Oncology Inc. Common Stock,$4.30 ,-0.11,-2.49%,391319410,United States,2021,339995,Health Care,Biotechnology: Pharmaceutical Preparations
PZG,Paramount Gold Nevada Corp. Common Stock,$1.18 ,0.01,0.86%,92462943,United States,2015,524200,Basic Materials,Metal Mining
PZZA,Papa John's International Inc. Common Stock,$41.41 ,-0.53,-1.26%,1357809717,United States,1993,534649,Consumer Discretionary,Restaurants
Q,Qnity Electronics Inc. Common Stock,$78.94 ,-5.86,-6.91%,16535024534,United States,2025,2778238,Technology,Semiconductors
QCLS,Q/C Technologies Inc. Common Stock,$4.77 ,-0.58,-10.84%,19875445,United States,2014,1894023,Health Care,Biotechnology: In Vitro & In Vivo Diagnostic Substances
QCOM,QUALCOMM Incorporated Common Stock,$178.29 ,-2.98,-1.64%,1.90949E+11,United States,1991,8862664,Technology,Radio And Television Broadcasting And Communications Equipment
QCRH,QCR Holdings Inc. Common Stock,$86.57 ,-0.95,-1.09%,1457722190,United States,,96441,Finance,Major Banks
QDEL,QuidelOrtho Corporation Common Stock,$28.80 ,-0.86,-2.90%,1956428352,United States,,603310,Health Care,Biotechnology: In Vitro & In Vivo Diagnostic Substances
QETA,Quetta Acquisition Corporation Common Stock,$11.35 ,0,0.00%,0,United States,2023,4332,Finance,Blank Checks
QETAR,Quetta Acquisition Corporation Right,$1.50 ,0,0.00%,0,United States,2023,2,Finance,Blank Checks
QIPT,Quipt Home Medical Corp. Common Shares,$2.61 ,0.08,3.16%,113388767,United States,,213455,Health Care,Misc Health and Biotechnology Services
QLYS,Qualys Inc. Common Stock,$152.53 ,0.22,0.14%,5469467719,United States,2012,382215,Technology,Computer Software: Prepackaged Software
QMCO,Quantum Corporation Common Stock,$9.03 ,-0.72,-7.39%,123903258,United States,,554441,Technology,Electronic Components
QNCX,Quince Therapeutics Inc. Common Stock,$4.22 ,-0.18,-4.09%,234975888,United States,2019,956614,Health Care,Biotechnology: Biological Products (No Diagnostic Substances)
QNST,QuinStreet Inc. Common Stock,$14.50 ,-0.05,-0.34%,822897838,United States,2010,688686,Real Estate,Real Estate
QNTM,Quantum Biopharma Ltd. Class B Subordinate Voting Shares,$9.38 ,-0.46,-4.68%,35803347,Canada,,18964,Health Care,Biotechnology: Pharmaceutical Preparations
QQQX,Nuveen NASDAQ 100 Dynamic Overwrite Fund Shares of Beneficial Interest,$27.99 ,-0.32,-1.13%,0,United States,,77001,Finance,Finance Companies
QRHC,Quest Resource Holding Corporation Common Stock,$2.15 ,-0.08,-3.59%,44870702,United States,,24733,Utilities,Environmental Services
QRVO,Qorvo Inc. Common Stock,$88.07 ,-1.34,-1.50%,8137396832,United States,,1215645,Technology,Semiconductors
QS,QuantumScape Corporation Class A Common Stock,$11.80 ,-0.99,-7.74%,7095460277,United States,2020,15512198,Miscellaneous,Industrial Machinery/Components
QSEA,Quartzsea Acquisition Corporation Ordinary Shares,$10.21 ,0,0.00%,0,United States,2025,23754,Finance,Blank Checks
QSEAR,Quartzsea Acquisition Corporation Rights,$0.30 ,0.01,3.45%,0,United States,2025,500,Finance,Blank Checks
QSI,Quantum-Si Incorporated Class A Common Stock,$1.29 ,-0.11,-7.86%,277981668,United States,2020,5613040,Industrials,Industrial Machinery/Components
QSIAW,Quantum-Si Incorporated Warrant,$0.23 ,-0.0033,-1.39%,50510777,United States,2020,5132,Industrials,Industrial Machinery/Components
QSR,Restaurant Brands International Inc. Common Shares,$70.87 ,0.42,0.60%,32231335966,Canada,2014,4384190,Consumer Discretionary,Restaurants
QTRX,Quanterix Corporation Common Stock,$7.56 ,0.01,0.13%,353133625,United States,2017,431397,Industrials,Biotechnology: Laboratory Analytical Instruments
QTTB,Q32 Bio Inc. Common Stock,$2.96 ,-0.22,-6.92%,36420882,United States,2018,326482,Health Care,Biotechnology: Pharmaceutical Preparations
QTWO,Q2 Holdings Inc. Common Stock,$75.31 ,-0.18,-0.24%,4709134677,United States,2014,627794,Technology,Computer Software: Prepackaged Software
QUAD,Quad Graphics Inc Class A Common Stock,$6.42 ,-0.11,-1.69%,326658428,United States,,211748,Consumer Discretionary,Publishing
QUBT,Quantum Computing Inc. Common Stock,$12.05 ,-0.78,-6.08%,2700685813,United States,,18134921,Technology,Computer Software: Prepackaged Software
QUIK,QuickLogic Corporation Common Stock,$6.28 ,-0.13,-2.03%,107326789,United States,1999,155630,Technology,Semiconductors
QUMS,Quantumsphere Acquisition Corp. Ordinary Shares,$10.00 ,0,0.00%,0,United States,2025,31,,
QUMSU,Quantumsphere Acquisition Corp. Units,$10.18 ,0,0.00%,0,United States,2025,101,,
QVCC,QVC Inc. 6.250% Senior Secured Notes due 2068,$8.79 ,-0.4,-4.35%,0,United States,2019,149902,Consumer Discretionary,Catalog/Specialty Distribution
QVCD,QVC Inc. 6.375% Senior Secured Notes due 2067,$9.08 ,-0.14,-1.52%,0,United States,2018,23621,Consumer Discretionary,Catalog/Specialty Distribution
QVCGA,QVC Group Inc. Series A Common Stock,$12.26 ,0.425,3.59%,98879075,United States,,47702,Consumer Discretionary,Catalog/Specialty Distribution
QVCGP,QVC Group Inc. 8.0% Fixed Rate Cumulative Redeemable Preferred Stock,$4.13 ,0.17,4.29%,33322773,United States,,107112,Consumer Discretionary,Catalog/Specialty Distribution
QXO,QXO Inc. Common Stock,$21.38 ,-0.74,-3.35%,14418501708,United States,,7903707,Consumer Discretionary,RETAIL: Building Materials
QXO^B,QXO Inc.  Depositary Shares each representing a 1/20th interest in a share of 5.50% Series B Mandatory Convertible Preferred Stock,$60.28 ,-1.81,-2.92%,,United States,,29016,,
R,Ryder System Inc. Common Stock,$189.54 ,-8.48,-4.28%,7652968254,United States,,603470,Consumer Discretionary,Rental/Leasing Companies
RA,Brookfield Real Assets Income Fund Inc. Common Stock,$12.88 ,-0.07,-0.54%,0,United States,2016,246992,Finance,Investment Managers
RAAQ,Real Asset Acquisition Corp. Class A Ordinary Share,$10.23 ,-0.0099,-0.10%,0,United States,2025,46786,,
RAAQU,Real Asset Acquisition Corp. Unit,$10.40 ,0,0.00%,0,United States,2025,12,Finance,Blank Checks
RAAQW,Real Asset Acquisition Corp. Warrants,$0.58 ,-0.0001,-0.02%,0,United States,2025,2693,,
RAIL,FreightCar America Inc. Common Stock,$9.78 ,0.02,0.21%,186593657,United States,2005,154024,Industrials,Railroads
RAIN,Rain Enhancement Technologies Holdco Inc. Class A Common Stock,$6.19 ,-0.07,-1.12%,50688876,United States,,15982,Technology,Industrial Machinery/Components
RAINW,Rain Enhancement Technologies Holdco Inc. Warrants,$0.28 ,0,0.00%,2292873,United States,,454,Technology,Industrial Machinery/Components
RAL,Ralliant Corporation Common Stock,$50.96 ,-1.26,-2.41%,5748584944,United States,2025,1046909,Industrials,Industrial Machinery/Components
RAMP,LiveRamp Holdings Inc. Common Stock,$30.21 ,-0.09,-0.30%,1922831577,United States,2018,584629,Technology,EDP Services
RAND,Rand Capital Corporation Common Stock,$15.96 ,0.01,0.06%,47398231,United States,,6921,Finance,Finance: Consumer Services
RANG,Range Capital Acquisition Corp. Ordinary Shares,$10.40 ,0,0.00%,0,United States,2025,228422,,
RANGR,Range Capital Acquisition Corp. Rights,$0.45 ,0,0.00%,0,United States,2025,400,,
RANI,Rani Therapeutics Holdings Inc. Class A Common Stock,$1.34 ,-0.13,-8.84%,162838596,United States,2021,3346595,Health Care,Biotechnology: Pharmaceutical Preparations
RAPP,Rapport Therapeutics Inc. Common Stock,$30.27 ,1.49,5.18%,1442702647,United States,2024,312884,Health Care,Biotechnology: Pharmaceutical Preparations
RAPT,RAPT Therapeutics Inc. Common Stock,$36.80 ,1.52,4.31%,1019760053,United States,2019,554061,Health Care,Biotechnology: Pharmaceutical Preparations
RARE,Ultragenyx Pharmaceutical Inc. Common Stock,$36.23 ,0.03,0.08%,3495382325,United States,2014,1589482,Health Care,Biotechnology: Pharmaceutical Preparations
RAVE,Rave Restaurant Group Inc. Common Stock,$2.84 ,-0.03,-1.05%,40360847,United States,,14605,Consumer Discretionary,Food Distributors
RBA,RB Global Inc. Common Stock,$103.95 ,-1.18,-1.12%,19302683608,Canada,,1209192,Real Estate,Real Estate
RBB,RBB Bancorp Common Stock,$22.05 ,-0.13,-0.59%,375884079,United States,2017,58685,Finance,Major Banks
RBBN,Ribbon Communications Inc. Common Stock,$2.98 ,-0.06,-1.97%,526266778,United States,,699613,Technology,EDP Services
RBC,RBC Bearings Incorporated Common Stock,$460.17 ,2.02,0.44%,14546637265,United States,2022,174265,Industrials,Metal Fabrications
RBCAA,Republic Bancorp Inc. Class A Common Stock,$74.28 ,0.37,0.50%,1451235621,United States,1998,35104,Finance,Major Banks
RBKB,Rhinebeck Bancorp Inc. Common Stock,$12.31 ,0.34,2.84%,137203333,United States,2019,17749,Finance,Banks
RBLX,Roblox Corporation Class A Common Stock,$88.51 ,-5.83,-6.18%,62127426713,United States,2021,8439454,Technology,Computer Software: Prepackaged Software
